{
    "$schema":  "./feature_list.schema.json",
    "schema":  "RVX.AgentFeatureList",
    "schemaVersion":  1,
    "updatedAt":  "2026-08-29T09:06:39.2449807Z",
    "activeFeature":  null,
    "features":  [
                     {
                         "id":  "gfx-22a",
                         "name":  "Renderer ownership and composition convergence",
                         "behavior":  "RenderComposition owns renderer feature and pass bundles behind narrow services, SceneRenderer orchestrates immutable frame data instead of caching mutable feature/pass pointers, and a new feature can be composed without extending a central hard-coded pass list.",
                         "owner":  "primary-coordinator",
                         "scope":  {
                                       "include":  [
                                                       "Source/Runtime/Render/Include/Render/Features/**",
                                                       "Source/Runtime/Render/Private/Features/**",
                                                       "Source/Runtime/Render/Include/Render/Renderer/**",
                                                       "Source/Runtime/Render/Private/Renderer/**",
                                                       "Source/Runtime/Render/Include/Render/Passes/**",
                                                       "Source/Runtime/Render/Private/Passes/**",
                                                       "Source/Runtime/Render/CMakeLists.txt",
                                                       "Scripts/check_renderer_feature_ownership.py",
                                                       "Scripts/test_renderer_feature_ownership.py",
                                                       "Tests/RenderFeatureValidation/**",
                                                       "Tests/RenderPassValidation/**",
                                                       "Tests/RendererCompositionLinkClosureValidation/**",
                                                       "Tests/GPUDrivenValidation/main.cpp",
                                                       "Tests/PipelineCacheValidation/main.cpp",
                                                       "Tests/WaterRenderValidation/main.cpp",
                                                       "Tests/CMake/ArchitectureTests.cmake",
                                                       "feature_list.json",
                                                       "progress.md",
                                                       "session-handoff.md"
                                                   ],
                                       "exclude":  [
                                                       "AGENTS.md",
                                                       "CLAUDE.md",
                                                       "Docs/README.md",
                                                       "Docs/engine-capabilities.json",
                                                       ".agent-harness/**",
                                                       "Source/Runtime/Render/Include/Render/Renderer/ViewData.h",
                                                       "Source/Runtime/Render/Shaders/GPUDriven/GPUSceneRaster.hlsli",
                                                       "Samples/**",
                                                       "Source/Runtime/RHI*/**",
                                                       "Source/Runtime/ResourceRuntime/**",
                                                       "Source/Developer/**",
                                                       "Source/Programs/**",
                                                       "assets/**",
                                                       "build/**"
                                                   ]
                                   },
                         "dependencies":  [

                                          ],
                         "acceptanceCriteria":  [
                                                    "RenderComposition is the sole construction owner for built-in renderer features and their pass bundles; SceneRenderer no longer constructs the built-in pass list.",
                                                    "Feature adapters do not retain mutable RenderPassRegistry, IRenderPass, or concrete pass pointers; cross-feature exchange uses typed graph resources and immutable frame plans.",
                                                    "SceneRenderer remains the frame orchestrator but no longer caches built-in feature adapter pointers or concrete built-in pass pointers for composition-time wiring.",
                                                    "Forward+, Deferred, Hybrid RT, particles, water, transparency, post-process, and existing execution receipts remain behaviorally equivalent.",
                                                    "A fail-closed architecture checker rejects reintroduction of central built-in pass construction or mutable pass pointer ownership in feature adapters.",
                                                    "Focused renderer tests, Architecture, full Windows Build Truth, Shipping cooked-only closure, and diff hygiene pass without touching protected user files."
                                                ],
                         "verification":  [
                                              {
                                                  "id":  "ownership-static",
                                                  "layer":  "static",
                                                  "command":  "\u0026 'C:\\Users\\yinzs\\.cache\\codex-runtimes\\codex-primary-runtime\\dependencies\\python\\python.exe' Scripts\\test_renderer_feature_ownership.py; if ($LASTEXITCODE -ne 0) { exit $LASTEXITCODE }; \u0026 'C:\\Users\\yinzs\\.cache\\codex-runtimes\\codex-primary-runtime\\dependencies\\python\\python.exe' Scripts\\check_renderer_feature_ownership.py --root .",
                                                  "required":  true,
                                                  "expectedArtifact":  null,
                                                  "expectedReceipt":  null
                                              },
                                              {
                                                  "id":  "focused-build",
                                                  "layer":  "focused",
                                                  "command":  "cmake --build --preset win_x64_debug --target RenderFeatureValidation RenderPassValidation RendererCompositionLinkClosureValidation",
                                                  "required":  true,
                                                  "expectedArtifact":  null,
                                                  "expectedReceipt":  null
                                              },
                                              {
                                                  "id":  "focused-tests",
                                                  "layer":  "focused",
                                                  "command":  "ctest --test-dir build\\win_x64_debug -C Debug --output-on-failure -R \"^(RenderFeatureValidation|RenderPassValidation|Architecture.RendererTargetClosure)(\\\\.|$)\"",
                                                  "required":  true,
                                                  "expectedArtifact":  null,
                                                  "expectedReceipt":  null
                                              },
                                              {
                                                  "id":  "architecture-required-suite",
                                                  "layer":  "architecture",
                                                  "command":  "pwsh -NoProfile -ExecutionPolicy Bypass -File .\\init.ps1 -Mode Verify -Preset win_x64_debug -BuildDir build\\win_x64_debug -Configuration Debug",
                                                  "required":  true,
                                                  "expectedArtifact":  ".agent-harness/receipts/Architecture.{runId}.json",
                                                  "expectedReceipt":  {
                                                                          "kind":  "Architecture",
                                                                          "baseRef":  "master",
                                                                          "preset":  "win_x64_debug",
                                                                          "testPreset":  "win_x64_debug_architecture",
                                                                          "buildDir":  "build/win_x64_debug",
                                                                          "configuration":  "Debug",
                                                                          "buildTarget":  "RVXValidationArchitecture",
                                                                          "requiredLabel":  "lane.architecture",
                                                                          "allowConfigure":  false
                                                                      }
                                              },
                                              {
                                                  "id":  "full-debug-build-truth",
                                                  "layer":  "integration",